"Family","Representative_model","Why_tested","Decision","CV_RMSE","Holdout_RMSE"
"Direct gain baseline","Gain readiness model","Directly predicts score gain from starting profile and context.","Compared; not selected by repeated-CV expected-gain RMSE.","4.705","4.400"
"Predicted EOY baseline","EOY readiness model","Predicts final EOY score first, then converts it to expected gain.","Selected operating family.","4.705","4.400"
"Interaction surface","EOY interaction model","Tests whether baseline score and readiness effects vary by track and attendance.","Compared; not selected by repeated-CV expected-gain RMSE.","4.712","4.413"
"GAM smooths","EOY GAM","Uses smooth nonlinear functions for baseline, readiness, attendance, and year effects.","Compared; not selected by repeated-CV expected-gain RMSE.","4.710","4.425"
"Random forest","Gain random forest","Tests a flexible tree ensemble without teacher, course ID, or section ID effects.","Compared; not selected by repeated-CV expected-gain RMSE.","4.820","4.612"
"Gradient boosting","Gain gradient boosting","Tests boosted trees for nonlinear interactions without persistent ID effects.","Compared; not selected by repeated-CV expected-gain RMSE.","4.804","4.534"
"Teacher/course ID leakage check","Teacher/course leakage benchmark","Shows what happens when teacher and course IDs are included; excluded from operations because it would absorb the review signals.","Excluded from operating selection; persistent IDs would contaminate future review signals.","4.723","4.428"
